<?xml version="1.0" encoding="UTF-8"?>


<cabinet xmlns="http://www.ujf-grenoble.fr/l3miage/medical" 
         xmlns:xsi="http://www.w3.org/2001/XMLSchema-instance" 
         xsi:schemaLocation="http://www.ujf-grenoble.fr/l3miage/medical ../xsd/cabinetInfirmier.xsd" >
    <nom>Soins a Grenoble</nom>
    <adresse>
        <numéro>60</numéro>
        <rue>rue de la Chimie</rue>
        <ville>Grenoble</ville>
        <codePostal>38041</codePostal>
        
    </adresse>
    <infirmiers>
        <infirmier id="001">
            <nom>Freechie</nom>
            <prénom>Sarah</prénom>
            <photo>sarah.png</photo>
        </infirmier>
        <infirmier id="002">
            <nom>Stickee</nom>
            <prénom>Sophie</prénom>
            <photo>sophie.png</photo>
        </infirmier>
        <infirmier id="003">
            <nom>Ochon</nom>
            <prénom>Paul</prénom>
            <photo>paul.png</photo>
        </infirmier>
    </infirmiers>
    <patients>
        <patient>
            <!-- Homme , né en août 98 en France , à Marseille (numéro 55 en bouche du rhône) 458e naissance -->
            <nom>Alcole</nom>
            <prénom>Yvon</prénom>
            <sexe>F</sexe>
            <naissance>1998-08-22</naissance>
            <numéro>198082205545852</numéro>
            <adresse>
                <étage>6</étage>
                <numéro>50</numéro>
                <rue>avenue Félix Viallet</rue>
                <ville>Grenoble</ville>
                <codePostal>38031</codePostal>
            </adresse>
            <visite date="2015-12-08" intervenant="001">
                <acte id="109"/>
            </visite>
        </patient>
        <patient>
            <!--Elvire est née le 08 mars 82 en France, à Lyon (n° 23 dans le rhône), il s'agissait de la 52e naissance-->
            <nom>Orouge</nom>
            <prénom>Elvire</prénom>
            <sexe>F</sexe>
            <naissance>1982-03-08</naissance>
            <numéro>282036902305218</numéro>
            <adresse>
                <étage></étage>
                <numéro></numéro>
                <rue>Rond-Point de la Croix de Vie</rue>
                <ville>La Tronche</ville>
                <codePostal>38700</codePostal>
            </adresse>
            <visite date="2015-12-08" intervenant="002" >
                <acte id="300"/>   
            </visite>
        </patient>
        <patient>
            <!-- Oscare est née le 25 mars 75 en France, à Chambéry (n° 65 dans la Savoie) Il s'agissait de la 692e naissance -->
            <nom>Pien</nom>
            <prénom>Oscare</prénom>
            <sexe>F</sexe>
            <naissance>1975-03-25</naissance>
            <numéro>275037306569202</numéro>
            <adresse>
                <étage></étage>
                <numéro></numéro>
                <rue>rue Casimir Brenier</rue>
                <ville>Grenoble</ville>
                <codePostal>38000</codePostal>
            </adresse>
            <visite date="2015-12-08" intervenant="002">
                <acte id="104"/>
                <acte id="105"/>  
            </visite>
            
        </patient>
        <patient>
            <!-- né le 02 août 2011 en France, à Bordeaux (n° 63 dans la Gironde). Il s'agi de la 35e naissance. -->
            <nom>Kapoetla</nom>
            <prénom>Xavier</prénom>
            <sexe>F</sexe>
            <naissance>2011-08-02</naissance>
            <numéro>111083306303521</numéro>
            <adresse>
                <étage></étage>
                <numéro>25</numéro>
                <rue>rue des Martyrs</rue>
                <ville>Grenoble</ville>
                <codePostal>38042</codePostal>
            </adresse>
            <visite date="2015-12-08" intervenant="002">
                <acte id="111"/>
            </visite>
            
        </patient>
    </patients>
</cabinet>

